{
  "$schema": "https://json-schema.org/draft/2020-12/schema",
  "$id": "https://example.com/finrobot/retail_sentiment/adapter_clean_skip_v1.schema.json",
  "title": "FinRobotRetailSentimentAdapterCleanSkipV1",
  "type": "object",
  "additionalProperties": false,
  "required": [
    "schema_version",
    "provider_free",
    "live_network",
    "real_dependency_imports",
    "adapter_id",
    "requested_capability",
    "ok",
    "skip",
    "unsupported_reason",
    "dependency_imported",
    "credential_required",
    "clean_skip",
    "fixture_key"
  ],
  "properties": {
    "schema_version": {"type": "integer"},
    "provider_free": {"type": "boolean", "const": true},
    "live_network": {"type": "boolean", "const": false},
    "real_dependency_imports": {"type": "boolean", "const": false},
    "adapter_id": {"type": "string"},
    "requested_capability": {"type": "string"},
    "ok": {"type": "boolean", "const": false},
    "skip": {"type": "boolean", "const": true},
    "unsupported_reason": {"type": "string"},
    "dependency_imported": {"type": "boolean", "const": false},
    "credential_required": {"type": "boolean", "const": false},
    "clean_skip": {"type": "boolean", "const": true},
    "fixture_key": {"type": "string"}
  }
}
