{
  "schema_version": 1,
  "provider_free": true,
  "live_network": false,
  "real_dependency_imports": false,
  "adapter_id": "adanos",
  "requested_capability": "finance.retail_sentiment.adanos.snapshot",
  "ok": false,
  "skip": true,
  "unsupported_reason": "Adapter adanos is outside the provider-free retail_sentiment skeleton and clean-skips until an external adapter package is installed.",
  "dependency_imported": false,
  "credential_required": false,
  "clean_skip": true,
  "fixture_key": "retail_sentiment:adapter_clean_skip:offline"
}
